{
  "coders": [
    {
      "active_status": "INACTIVE_DRY_RUN",
      "affiliation_class": null,
      "authorization_status": "ABSENT_BLOCKED",
      "blinding_status": "PLANNED_NOT_VERIFIED",
      "coder_id": "SYNTHETIC_CODER_A",
      "coder_type": "primary_coder",
      "coding_eligibility": false,
      "coding_performed": false,
      "conflict_of_interest_status": "NOT_ASSESSED",
      "created_date": "2026-07-11",
      "display_role": "synthetic primary coder",
      "final_authorization_status": "ABSENT_BLOCKED",
      "manual_hash": "sha256:797d79fcdb29fc32850c3778c6afb029ac0768207ea33f66d714fe8fa8cb591a",
      "manual_version": "friction_locus_manual_v0_1",
      "notes": "Synthetic metadata only; no identity, packet access, authorization, or coding event.",
      "private_packet_access_eligibility": false,
      "record_hash": "sha256:554e0400b2113614a2762109b9eacd200dc434243ce6f6ed3ad42f5cb02bbb4a",
      "reviewer": "synthetic_scaffold_validator",
      "schema_version": "1.0.0",
      "training_status": "NOT_STARTED"
    },
    {
      "active_status": "INACTIVE_DRY_RUN",
      "affiliation_class": null,
      "authorization_status": "ABSENT_BLOCKED",
      "blinding_status": "PLANNED_NOT_VERIFIED",
      "coder_id": "SYNTHETIC_CODER_B",
      "coder_type": "secondary_coder",
      "coding_eligibility": false,
      "coding_performed": false,
      "conflict_of_interest_status": "NOT_ASSESSED",
      "created_date": "2026-07-11",
      "display_role": "synthetic secondary coder",
      "final_authorization_status": "ABSENT_BLOCKED",
      "manual_hash": "sha256:797d79fcdb29fc32850c3778c6afb029ac0768207ea33f66d714fe8fa8cb591a",
      "manual_version": "friction_locus_manual_v0_1",
      "notes": "Synthetic metadata only; no identity, packet access, authorization, or coding event.",
      "private_packet_access_eligibility": false,
      "record_hash": "sha256:a69ec1c7e7d071441af0c66364138b5f0657e05313a0d7ed20692fd77e436750",
      "reviewer": "synthetic_scaffold_validator",
      "schema_version": "1.0.0",
      "training_status": "NOT_STARTED"
    },
    {
      "active_status": "INACTIVE_DRY_RUN",
      "affiliation_class": null,
      "authorization_status": "ABSENT_BLOCKED",
      "blinding_status": "PLANNED_NOT_VERIFIED",
      "coder_id": "SYNTHETIC_ADJUDICATOR",
      "coder_type": "adjudicator",
      "coding_eligibility": false,
      "coding_performed": false,
      "conflict_of_interest_status": "NOT_ASSESSED",
      "created_date": "2026-07-11",
      "display_role": "synthetic adjudicator",
      "final_authorization_status": "ABSENT_BLOCKED",
      "manual_hash": "sha256:797d79fcdb29fc32850c3778c6afb029ac0768207ea33f66d714fe8fa8cb591a",
      "manual_version": "friction_locus_manual_v0_1",
      "notes": "Synthetic metadata only; no identity, packet access, authorization, or adjudication event.",
      "private_packet_access_eligibility": false,
      "record_hash": "sha256:5edc6549e428b935c8b92613843d00ff24712e3be0506ed25c916ff8d9878d77",
      "reviewer": "synthetic_scaffold_validator",
      "schema_version": "1.0.0",
      "training_status": "NOT_STARTED"
    }
  ],
  "no_coding_authorization": true,
  "no_coding_performed": true,
  "no_private_packet_access": true,
  "no_real_coder_registered": true,
  "record_hash": "sha256:1b16a9584410d0ac374d3b20b549df43638e5e78b219c13afd8b71934fb44ba3",
  "registry_status": "SYNTHETIC_DRY_RUN_BLOCKED",
  "schema_version": "1.0.0",
  "synthetic_only": true
}
